num,title,link,content
365,"신한금융, 730억원에 네오플럭스 인수",http://www.pressm.kr/news/articleView.html?idxno=32513,"신한금융지주회사는 20일 두산과 네오플럭스 주식매매계약 (SPA)을 체결했다. 앞서 양사는 각각 이사회를 열어 네오플럭스 지분 매매에 대한 안건을 의결했다. 이날 신한금융은 네오플럭스 보통주 24,413,230주(지분율 96...."
366,"푸르덴셜생명, 금융 라이프스타일 매거진 '배러 투모로우' 사이트 열어",http://www.businesspost.co.kr/BP?command=article_view&num=192590,푸르덴셜생명이 금융 라이프스타일 매거진 'BETTER TOMORROW'(베러 투모로우) 사이트를 열었다고 20일 밝혔다. 푸르덴셜생명이 금융 라이프 스타일 매거진 'BETTER TOMORROW'(베러 투모로우) 사이트를 열었다. 푸르덴셜생명은...
367,"금융서비스는 여기에 다 있다, 하나은행 '뉴 하나원큐'",http://www.hkbs.co.kr/news/articleView.html?idxno=585861,?김다정?기자?=?하나은행(은행장?지성규)은?세상의?모든?금융을?담은?모바일금융?앱?「뉴?하나원큐」를?출시하고?평생?이체수수료?면제?등?다양한?손님?이벤트를?실시한다고?밝혔다. ▷세상의?모든...
368,"우리금융그룹, 스타트업들에 금융IT 교육 실시",http://www.choicenews.co.kr/news/articleView.html?idxno=73812,"우리금융그룹(회장 손태승,?이하 우리금융)은?21일?""스타트업 육성 프로그램인 디노랩 입주기업을 대상으로 금융?IT(정보통신)?교육을 실시했다""고 밝혔다. 우리금융에 따르면 이번 교육은 금융권 현장에서 실제..."
369,"“언택트 시대, 개인정보보안은 필수”…SKT, ‘금융+5G양자보안’ 모바일뱅킹...",http://www.sportsseoul.com/news/read/949096?ref=naver,특히 금융 분야에서의 보안은 필수불가결한 사안임에 틀림이 없다. 이에 SK텔레콤이 자사의 5G(5세대 이동통신) 양자보안 기술을 금융에 적용해 개인정보 보안성을 한층 더 강화한 금융서비스를 내놓았다. SK텔레콤은...
370,주택금융공사 공채 응시 20대 확진...서울 여의도중서 시험,https://www.ytn.co.kr/_ln/0103_202008210935362654,한국주택금융공사 신입 채용 시험을 봤던 응시생이 코로나19 확진 판정을 받았습니다. 서울 영등포구청은 지난 15일 여의도중학교에서 치러진 주택금융공사의 채용시험에 응시했던 강동구 주민 20대 A 씨가 나흘 뒤인...
371,"신한금융, 두산 '네오플럭스' 730억원에 인수…독립 전문 VC 품는다",http://www.ajunews.com/view/20200820191733076,한영훈 기자 han@ajunews.com 신한금융지주가 두산그룹 벤처캐피탈(VC) 자회사인 네오플럭스를 인수했다. 이로써 기업 전 생애주기에 대응할 수 있는 그룹 내 투자금융 밸류체인을 완성하게 됐다. 신한금융은 20일 두산과...
372,주택금융공사 공채 응시 20대 확진...서울 여의도중서 시험,https://www.ytn.co.kr/_ln/0103_202008210935362654,한국주택금융공사 신입 채용 시험을 봤던 응시생이 코로나19 확진 판정을 받았습니다. 서울 영등포구청은 지난 15일 여의도중학교에서 치러진 주택금융공사의 채용시험에 응시했던 강동구 주민 20대 A 씨가 나흘 뒤인...
373,우리금융-KT의 '디지털 동맹' 윤곽,https://www.paxnetnews.com/articles/64374,우리금융그룹과 KT그룹이 구체적인 청사진을 내놨다. 양사는 지난 2017년 서비스를 시작한 인터넷전문은행인 케이뱅크 설립을 함께 준비하며 협업한 경험이 있다. 양사는 현재도 케이뱅크의 1·2대주주다. 우리금융과 KT는...
374,"두산, 신한금융지주에 네오플럭스 매각",http://www.lawissue.co.kr/view.php?ud=20200820164737341204ead0791_12,"㈜두산은 신한금융지주와 네오플럭스 지분 매각 계약을 체결했다고 20일 밝혔다. 이번 매각은 그룹... 이에 앞서 두산중공업은 지난 2일, 클럽모우 CC를 하나금융-모아미래도 컨소시엄에 매각하고 채권단 차입금 상환을..."
375,IBK기업은행 '소상공인 2차 금융지원 대출' 금리 인하,https://www.ebn.co.kr/news/view/1447386/?sc=Naver,"IBK기업은행은 인터넷?모바일뱅킹에서 실행되는 '소상공인 2차 금융지원 대출'의 최고 금리를 기존의 연 3... 기업은행은 지난 6월 인터넷?모바일뱅킹에서 ‘소상공인 2차 금융지원 대출’의 대출 신청, 보증서 발급..."
376,"KB금융 윤종규 회장, 차세대 리더들과 ‘e-소통라이브’ 두 번째 시간 가져",http://www.lawissue.co.kr/view.php?ud=202008211227187496204ead0791_12,"KB금융그룹(회장 윤종규)은 지난 12일에 이어, 19일 CEO와 그룹 MZ세대 직원들이 함께 유튜브 생중계를 통해... 이 날 행사에는 지난 회차에 아쉽게 참가하지 못했던 주니어보드 활동 직원 등 다양한 MZ세대 직원들이 KB금융그..."
377,"대전 대덕구 ""탈(脫)석탄 금융기관에 재정 맡긴다""",https://www.nocutnews.co.kr/news/5398003,"기후위기에 대응하기 위한 것으로 앞으로 대덕구 구금고 지정을 신청하는 금융기관은 미세먼지 주범인... 기후금융 확산에 적극 동참하겠다""고 밝혔다. 한편 앞서 충남도와 서울시교육청 등이 금고 선정 시 탈석탄과..."
378,"BGF리테일, 빅데이터 판다…금융보안원과 업무협약",http://news.mk.co.kr/newsRead.php?no=858194&year=2020,편의점 CU에서 이뤄진 거래 데이터가 금융데이터거래소(FinDX)를 통해 빅데이터로 판매된다. 20일 BGF리테일은 전날 금융보안원과 편의점 데이터 유통과 활용 혁신을 위한 업무협약을 체결했다고 밝혔다. BGF리테일은...
379,"KB노협, KB금융 회장 연임 반대...추천 절차 시정 요구",http://www.geconomy.co.kr/news/articleView.html?idxno=17811,KB금융그룹 노동조합협의회가 윤종규 KB금융 회장의 3연임에 대해 회장 추천 절차를 즉각 시정하라고 요구하며 본적적으로 반대하고 나섰다. KB금융그룹 노동조합협의회(이하 'KB노협')는 20일 오전 서울 여의도...
380,"장혜영 의원 ""부동산 금융에 쏠린 돈 2100조원 넘어""",http://www.breaknews.com/749950,"부동산 금융 익스포저(위험노출액)잔액이 2,105조원에 달한 것으로 드러났다. 장혜영 의원은 ""부동산 금융은 부동산 가격이 급락하거나 금리가 급상승하는 등 리스크 발생 시 실물 경제로 전이되는 뇌관으로 작용할..."
381,"""유한양행, 기술이전 계약으로 R&D 역량 재부각…목표가↑""-하나금융투자",https://www.dailian.co.kr/news/view/913786/?sc=Naver,"하나금융투자는 21일 유한양행에 대해 전혀 예상치 못했던 대규모 기술이전 계약을 체결하면서... 선민정 하나금융투자 연구원은 ""유한양행은 지난 20일 미국 바이오텍 회사인 프로세사 파마슈티컬과 기능성..."
382,"BGF리테일, CU 소비 데이터 판매 등 금융보안원과 업무 협약",http://www.viva100.com/main/view.php?key=20200820010003646,"BGF리테일, CU 소비 데이터 판매 등 금융보안원과 업무 협약 CU를 운영하는 BGF리테일은 지난 19일 금융보안원과 편의점 데이터 유통 및 활용 혁신을 위한 업무 협약을 체결했다고 20일 밝혔다. 업무협약식은 BGF리테일의..."
383,"우리금융-KT, 마이데이터 사업 진출 합작사 세운다",http://www.fnnews.com/news/202008191731300245,우리금융그룹과 KT가 본격적인 마이데이터 사업 진출을 위한 JV(합작사)를 설립하기로 했다. 금융과 통신 데이터를 결합한 서비스를 개발해 기존 업체들과의 차별성을 높인다는 취지다. 인공지능(AI) 공동 교육 과정을...
384,"IBK기업은행, '소상공인 2차 금융지원 대출' 금리 인하",http://www.etnews.com/20200820000112,"IBK기업은행(행장 윤종원)은 인터넷·모바일뱅킹에서 실행되는 '소상공인 2차 금융지원 대출'의 최고... 기업은행은 지난 6월 인터넷〃모바일뱅킹에서 '소상공인 2차 금융지원 대출' 신청, 보증서 발급, 대출 실행 등..."
385,넷플릭스도 품은 구현모표 '협력벨트'…금융합작사로 꽃피운다,https://www.news1.kr/articles/?4030625,올해 초 구현모 대표이사 취임 이후 지속적으로 전방위 제휴 협력을 확대해온 KT가 이번에는 우리금융과 손을 맞잡았다. 금융과 ICT 영역의 벽이 허물어진 디지털금융 빅뱅시대에 대비하기 위한 포석으로 KT와...
386,"윤종규 KB금융 회장, 그룹 젊은 직원들과 두번째 '유튜브 소통'",http://www.newsfc.co.kr/news/articleView.html?idxno=42378,윤종규(왼쪽 첫번째) KB금융그룹 회장이 19일 서울 여의도 본점에서 직원들과 유튜브 생중계로 이야기하는 'e-소통라이브' 시간을 가지고 있다. /사진제공=KB금융 윤종규 KB금융그룹 회장이 그룹 내 젊은 직원들과 두 번째...
387,"농협상호금융, '다같이 동행 예금'출시",http://www.straightnews.co.kr/news/articleView.html?idxno=82060,농협중앙회 제공 이성희 농협중앙회장이 20일 서울 영등포농협을 찾아 최근 수도권 코로나19 확산에 따른 일선 금융창구와 경제사업장(하나로마트)의 코로나 방역상태를 점검하고 농협상호금융에서 출시한 '다같이...
388,"KT-우리금융, 디지털 금융 산업 선도 위해 맞손",http://www.fnnews.com/news/202008191120597078,KT그룹은 우리금융그룹과 대한민국 디지털 금융 산업을 선도하기 위해 전략적 제휴 협약(MOU)을 체결했다고 19일 밝혔다. 양사는 대한민국 1호 인터넷전문은행인 케이뱅크의 주요주주다. 이날 협약식에는 구현모 KT그룹...
389,"신한카드, 글로벌 자동차금융 확대 전략 시동",http://www.ftoday.co.kr/news/articleView.html?idxno=205200,"자동차 금융 제휴 협약(MOU)를 체결했다고 20일 밝혔다. 양사는 베이세노프 다우렌(Beisenov Dauren) 비펙... 자동차 금융, 신용 대출 등 소매 대출 상품을 취급하고 있다. 2019년 말 기준 누적 취급액 447억원, 자산 225억원..."
390,"윤종규 KB금융 회장, MZ세대 직원들과 'e-소통라이브' 두 번째 시간 가져",http://www.thefirstmedia.net/news/articleView.html?idxno=61988,"사진=KB금융 KB금융그룹은 지난 12일에 이어, 19일 CEO와 그룹 MZ세대 직원들이 함께 유튜브 생중계를 통해 격의 없는 대화와 이야기를 나눈 'e-소통라이브' 두 번째 시간을 가졌다고 21일 밝혔다. 이 날 행사에는 지난..."
391,"윤종규 KB금융 회장, MZ세대 직원들과 'e-소통라이브' 두 번째 시간 가져",http://www.thefirstmedia.net/news/articleView.html?idxno=61988,"사진=KB금융 KB금융그룹은 지난 12일에 이어, 19일 CEO와 그룹 MZ세대 직원들이 함께 유튜브 생중계를 통해 격의 없는 대화와 이야기를 나눈 'e-소통라이브' 두 번째 시간을 가졌다고 21일 밝혔다. 이 날 행사에는 지난..."
392,"KB국민은행, AI 경진대회 개최…AI 활용 신규 금융서비스 모델 발굴",http://www.fntimes.com/html/view.php?ud=202008201606084688ee0209bd21_18,"이번 대회는 AI기술을 적용한 미래금융 아이디어를 확보하고 우수인재들의 금융 분야 관심을 높이고자 마련됐으며, ‘KB-ALBERT’가 공모 분야에 추가됐다. ‘KB-ALBERT’는 최신 딥러닝 언어 모델인 ‘ALBERT’를..."
393,"우리금융, 스타트업 디노랩 통합센터 입주기업 대상 금융IT 교육 나서",http://www.techholic.co.kr/news/articleView.html?idxno=193122,우리금융그룹(회장 손태승)은 스타트업(Start-up) 육성 프로그램인 디노랩(Digital Innovation Lab) 입주기업을 대상으로 서울 성수동 통합센터에서 금융IT 교육을 실시했다고 21일 밝혔다. 그동안 혁신적인 아이디어를 보유한...
394,"정부 ""코로나19 재확산 우려...소상공인에 적극적인 금융지원""",http://www.efnews.co.kr/news/articleView.html?idxno=86247,"금융지원 프로그램은 19일 기준 6만명의 소상공인에게 대출을 공급했다""며 ""접근성이 높은 12개 시중은행을 통한 대출 공급과?신보의 위탁보증(95%), 비대면 대출 등을 통해?중?저신용등급 소상공인을 중심으로 금융접..."
395,"[아! 이 금융상품]DGB대구은행-SKT, ‘양자보안 모바일뱅킹’ 출시",http://www.econovill.com/news/articleView.html?idxno=408942,양사는 세계 최초로 5G 스마트폰에서 양자보안 기반 금융 서비스를 구현한다는 목표로 공동 개발을... 다른 국내 시중은행의 비대면 금융 거래도 급증하고 있는 추세다. 이에 따라 신종 금융사기 수법으로 개인 정보가...
396,"신한카드, 글로벌 자동차금융 확대전략 '시동'",http://www.kbanker.co.kr/news/articleView.html?idxno=92935,"자동차 금융 제휴 협약(MOU)을 체결했다고 20일 밝혔다. 양사는 베이세노프 다우렌(Beisenov Dauren) 비펙... 자동차 금융, 신용대출 등 소매 대출 상품을 취급하고 있다. 지난해 말 기준 누적 취급액 447억원, 자산 225억원..."
397,"""AI가 맞는 은행 만든다""…KT-우리금융 '맞손'",http://www.wowtv.co.kr/NewsCenter/News/Read?articleId=A202008190228&t=NN,대한민국에 통신과 금융을 최초로 선보인 KT와 우리금융이 손을 잡았다. KT그룹과 우리금융그룹은 우리은행 본점에서 전략적 제휴 협약을 체결했다고 19일 밝혔다. 양사는 대한민국 1호 인터넷전문은행인 케이뱅크의...
398,"두산, 신한금융지주에 네오플럭스 매각…재무구조 개선 ‘순항’",http://www.ajunews.com/view/20200820164438002,com ㈜두산은 신한금융지주와 네오플럭스 지분 매각 계약을 체결했다고 20일 밝혔다. 이번 매각은 그룹... 앞서 두산중공업은 지난 2일 클럽모우 CC를 하나금융-모아미래도 컨소시엄에 매각하고 채권단 차입금 상환을...
399,통신-금융 연합전선 구축 활발... 데이터 경제 시대 '정조준',https://www.techm.kr/news/articleView.html?idxno=74540,"#통신-금융 데이터 융합 가속화 #마이데이터 시대 경쟁력 갖추기 나서 #탈통신 분야 데이터 신산업 기회 모색 최근 SK텔레콤과 KT, LG유플러스 등 통신사와 금융업계 간 협업이 늘고 있다. 이동통신 고객 정보와 금융정보를..."
400,"농협상호금융, '다같이(多가치) 동행 예금' 출시",http://www.amnews.co.kr/news/articleView.html?idxno=43366,가입만으로 공익가치 실현…이성희 회장 1호 가입 농협상호금융이 '다같이(多가치) 동행 예금'을 출시했다.... 농협상호금융은 또 10월 말까지 1000만 원 이상 가입하고 이벤트에 응모한 개인고객 중 500명을 추첨해...
401,"농협상호금융, '다같이(多가치) 동행 예금' 출시",http://www.amnews.co.kr/news/articleView.html?idxno=43366,가입만으로 공익가치 실현…이성희 회장 1호 가입 농협상호금융이 '다같이(多가치) 동행 예금'을 출시했다.... 농협상호금융은 또 10월 말까지 1000만 원 이상 가입하고 이벤트에 응모한 개인고객 중 500명을 추첨해...
402,금융서비스도 AI·빅데이터로…KT-우리금융 디지털전환 제휴,http://yna.kr/AKR20200819060100017?did=1195m,금융 AI 인력 육성·데이터 활용 공동 신사업도 추진 KT는 우리금융그룹과 금융의 디지털전환(Digital Transformation)을 위해 전략적 제휴를 맺었다고 19일 밝혔다. 양사는 국내 최초 인터넷전문은행인 케이뱅크의 주요...
403,"금융보안원, 금융분야 데이터전문기관 업무 실시…신한카드·SKT 데이터 결합...",http://www.fntimes.com/html/view.php?ud=202008210850037864ee0209bd21_18,"미래에셋 데이터 익명 처리 적정성 평가 완료 금융보안원이 21일 금융분야 데이터전문기관 업무를 본격적으로 실시한다고 밝혔다. 금융분야 첫 데이터전문기관으로서, 한국판 디지털 뉴딜 성공과 데이터 경제 활성화에..."
404,"SK하이닉스, 3월 수준까지 급락-신한금융투자",https://www.ebn.co.kr/news/view/1447547/?sc=Naver,"신한금융투자는 SK하이닉스의 주가가 3월 수준까지 급락했다고 진단했다. 투자의견은 매수 유지, 목표주가는 기존 12만원에서 10만5000원으로 하향 조정했다. 21일 최도연 신한금융투자 연구원은 ""SK하이닉스의 3분기..."
405,'소통경영' 강행군하는 KB금융 윤종규...차세대 리더와 두번째 온라인 미팅,https://www.fetv.co.kr/news/article.html?no=61925,?KB금융 윤종규 회장의?'온라인 소통경영'이?연일 화제다. 특히?KB금융의 차세대 리더로 성장할 밀레니얼 세대의 젊은 직원이 온라인 소통의 핵심 타깃이라는 점에서 윤 회장의 일거수 일투족에?금융계의 시선이...
406,손잡은 우리금융·KT·케뱅 시너지 주목,http://www.m-i.kr/news/articleView.html?idxno=739339,"사진은 우리금융그룹과 KT가 19일 서울 중구 우리은행 본점에서 업무협약 체결 후 기념촬영을 하는 모습. 왼쪽부터 권광석 우리은행장, 구현모? KT그룹 대표,?손태승 우리금융그룹 회장, 이동면 BC카드 사장. 사진=KT..."
407,금융피해자들이 김조원 전 민정수석을 고발한 까닭,http://www.mediatoday.co.kr/news/articleView.html?idxno=208841,"금융피해자연대, 고발회견 “감찰반원에 감찰 의무없는 금감원 간부 감찰지시” “윤석헌 금감원장 겨냥” 직권남용·강요미수 주장 금융피해자들이 김조원 전 청와대 민정수석을 직권남용과 강요미수 등의 혐의로..."
408,"푸르덴셜생명, 금융 라이프스타일 매거진 'BETTER TOMORROW' 오픈",http://www.wikileaks-kr.org/news/articleView.html?idxno=93262,푸르덴셜생명(대표이사 커티스 장)은 금융 라이프스타일 매거진인 'BETTER TOMORROW' 사이트를 오픈했다고 20일 밝혔다. 'BETTER TOMORROW(이하?BT)'는 다양한 사람들의 라이프스타일을 소개하고 그들만의 유익한 금융 정보를...
409,"두산, 신한금융지주에 네오플럭스 매각…매각 대금 730억원",http://www.ftoday.co.kr/news/articleView.html?idxno=205232,"사진=두산 두산은 신한금융지주와 네오플럭스 지분 매각 계약을 체결했다고 20일 밝혔다. 이번 매각은 그룹... 이에 앞서 두산중공업은 지난 2일, 클럽모우 CC를 하나금융-모아미래도 컨소시엄에 매각하고 채권단 차입금..."
410,"“제가 건물주가 될 상인가요?…핀크, 미래자산 예측부터 금융 추천까지",https://www.ebn.co.kr/news/view/1447605/?sc=Naver,"등의 금융생활 습관에 따라 미래에 건물주가 될 확률을 재치 있게 분석해 주는 서비스이다. 이는 핀크가 운영 중인 마이데이터 서비스의 일환으로 자산관리의 시작이 필요한, 밀레니얼 세대가 테스트를 통해 자신의 금융..."
411,"KB금융 윤종규 회장-MZ세대 직원들, 'e-소통라이브' 진행",http://www.thedailypost.kr/news/articleView.html?idxno=75633,ⓒ데일리포스트=이미지 제공 / KB금융그룹 KB금융그룹이 CEO와 그룹 MZ세대 직원들이 함께 유튜브 생중계를 통해 격의 없는 대화와 이야기를 나눈 'e-소통라이브' 두 번째 시간을 가졌다. 이 날 행사에는 지난 회차에...
412,"신한카드, 글로벌 자동차금융 시동…카자흐스탄 1위사와 제휴",http://daily.hankooki.com/lpage/finance/202008/dh20200820093328148330.htm?s_ref=nv,"자동차 금융 제휴 협약(MOU)을 체결했다고 20일 밝혔다. 양사는 베이세노프 다우렌(Beisenov Dauren) 비펙 알마티... 자동차 금융, 신용 대출 등 소매 대출 상품을 취급하고 있다. 2019년 말 기준 누적 취급액 447억원, 자산..."
413,"AI와 금융의 콜라보... KB국민은행, 'Future Finance A.I. Challenge' 개최",http://www.koreaittimes.com/news/articleView.html?idxno=99805,"이번 대회는 AI기술을 적용한 미래금융 아이디어를 확보하고 우수인재들의 금융 분야 관심을 높이고자 마련됐으며, 'KB-ALBERT'가 공모 분야에 추가됐다. 'KB-ALBERT'는 최신 딥러닝 언어 모델인 'ALBERT'를 기반으로..."
414,"KT, 우리금융과 손잡고 금융·통신 '디지털 전환' 속도",https://www.hankyung.com/it/article/202008191449g,KT는 우리금융그룹과 손잡고 함께 금융과 통신 분야 데이터 산업 활성화에 나선다. 양사는 19일 서울 중구 우리은행 본점에서 이 같은 내용의 양해각서(MOU)를 체결했다. 두 기업은 모두 국내 1호 인터넷전문은행인...
415,"소통 늘리는 윤종규 KB금융 회장, MZ세대 직원들과 두번째 'e-소통라이브'",http://www.startuptoday.co.kr/news/articleView.html?idxno=51621,오늘경제 윤종규 KB금융그룹 회장이 19일 KB금융그룹 직원들과 'e-소통라이브' 시간을 가지고 있다. [사진=KB금융그룹] 윤종규 KB금융그룹 회장이 직원들과의 소통행보에 박차를 가하고 있다. 평소 '화이부동'의 마음으로...
416,KT-우리금융 MOU…마이데이터 등 디지털 금융 선도,http://www.etnews.com/20200819000309,"KT와 우리금융그룹이 디지털 금융 관련 협력을 위한 전략적 제휴 협약(MOU)을 체결했다. 양사는 인공지능(AI), 빅데이터 기반 금융 디지털 트랜스포메이션, 데이터 활용 공동 신사업, 금융 AI 인력육성 등 분야에서..."
417,"신한금융, 네오플럭스 인수...두산과 주식매매계약 체결",http://www.edaily.co.kr/news/newspath.asp?newsid=03755606625869288,신한금융지주는 20일 두산과 벤처캐피탈회사인 네오플럭스의 주식매매계약(SPA)을 체결했다고 밝혔다. 앞서 양사는 각각 이사회를 열어 네오플럭스 지분 매매에 대한 안건을 의결했다. 이날 신한금융은 네오플럭스...
418,"금감원, 집중호우 피해지역 방문해 금융지원 상담",http://www.newsis.com/view/?id=NISX20200819_0001133996&cID=10401&pID=10400,금융감독원은 최근 내린 집중호우로 일부 지역이 특별 재난 지역으로 선포되는 등 재산·인명 피해가 발생함에 따라 금융상담에 나서기로 했다. 금감원은 20일부터 27일까지 금융사랑방버스를 이용해 남원·곡성·구례...
419,"신한카드, 글로벌 자동차금융 확대 시동",http://www.finomy.com/news/articleView.html?idxno=81960,"자동차 금융 제휴 협약(MOU)을 체결했다고 20일 밝혔다. 양사는 베이세노프 다우렌(Beisenov Dauren) 비펙 알마티... 자동차 금융, 신용 대출 등 소매 대출 상품을 취급하고 있다. 2019년 말 기준 누적 취급액 447억원, 자산..."
420,"두산, 신한금융지주에 네오플럭스 매각",http://www.dizzotv.com/site/data/html_dir/2020/08/20/2020082080215.html,㈜두산은 신한금융지주와 네오플럭스 지분 매각 계약을 체결했다고 20일 밝혔다. 이번 매각은 그룹... 이에 앞서 두산중공업은 지난 2일 클럽모우 CC를 하나금융-모아미래도 컨소시엄에 매각하고 채권단 차입금 상환을...
421,"두산, 신한금융지주에 네오플럭스 매각",http://www.dizzotv.com/site/data/html_dir/2020/08/20/2020082080215.html,㈜두산은 신한금융지주와 네오플럭스 지분 매각 계약을 체결했다고 20일 밝혔다. 이번 매각은 그룹... 이에 앞서 두산중공업은 지난 2일 클럽모우 CC를 하나금융-모아미래도 컨소시엄에 매각하고 채권단 차입금 상환을...
422,부동산금융에 2100조 몰렸다,http://www.g-enews.com/ko-kr/news/article/news_all/202008200611216075a218188523_1/article.html,"부동산 금융에 몰린 돈이 무려 2100조 원이나 되는 것으로 나타났다. 20일 정의당 장혜영 의원이 한국은행으로부터 받은 자료에 따르면, 올해 1분기 현재 부동산 금융 익스포저(위험노출액) 잔액은 2105조3000억..."
423,"우리금융-KT 동맹…""디지털 주도권 잡겠다""",http://www.kyeonggi.com/news/articleView.html?idxno=2312023,"우리금융그룹과 KT그룹이 동맹을 맺었다. 금융과 통신을 결합해 AI, 데이터, 클라우드 등 다양한 분야에서 시너지를 내겠다는 계획이다. 두 그룹은 국내 최초 인터넷전문은행인 케이뱅크의 주요 주주이기도 하다...."
424,"안랩, 금융·방송사 클라우드 보안 서비스 사업 수주",http://www.inews24.com/view/1292142,안랩은 최근 대형 금융사 및 주요 방송사의 클라우드 정보보호 컨설팅과 보안관제 서비스 등 클라우드 보안 서비스 사업을 잇따라 수주했다고 20일 발표했다. 안랩은 지난 5월 국내 대형 금융사를 대상으로 '클라우드 이용...
425,"SK텔레콤, DGB대구은행과 '양자보안' 금융서비스 선봬",http://www.mediapen.com/news/view/550213,양사는 세계 최초로 5G 스마트폰에서 양자보안 기반 금융 서비스를 구현한다는 목표로 공동 개발을 마쳤다. 양사는 양자보안 산업의 생태계를 금융 영역으로 확장해 테크핀(기술+금융 합성어) 시장을 선도하겠다는...
